{
  "protocol_version": 1,
  "machine_id": "22222222-2222-4222-8222-222222222222",
  "stream_id": "33333333333343338333333333333333",
  "sequence": 2,
  "boot_id": "11111111-1111-4111-8111-111111111111",
  "sampled_at": "2026-10-15T12:00:10Z",
  "elapsed_seconds": 10,
  "scope": "sandbox",
  "capabilities": {
    "os": "linux",
    "process_identity": true,
    "cpu": true,
    "memory": true,
    "disk": true,
    "network": true,
    "load": true,
    "psi_cpu": false,
    "psi_memory": false,
    "psi_io": false,
    "clock_ticks_per_second": 100
  },
  "coverage": {
    "processes": {
      "status": "complete",
      "reason": null,
      "discovered": 3,
      "sampled": 3,
      "permission_denied": 0,
      "vanished": 0,
      "malformed": 0,
      "scan_limited": false,
      "enumeration_limited": false
    }
  },
  "metrics": {
    "cpu_percent": {
      "value": 25,
      "status": "available"
    },
    "memory": {
      "total_bytes": {
        "value": 1073741824,
        "status": "available"
      },
      "available_bytes": {
        "value": 536870912,
        "status": "available"
      },
      "used_bytes": {
        "value": 536870912,
        "status": "available"
      }
    },
    "disks": [
      {
        "label": "system",
        "total_bytes": {
          "value": 10737418240,
          "status": "available"
        },
        "available_bytes": {
          "value": 5368709120,
          "status": "available"
        },
        "used_bytes": {
          "value": 5368709120,
          "status": "available"
        }
      }
    ],
    "network": [
      {
        "label": "uplink",
        "receive_bytes_per_second": {
          "value": 1024,
          "status": "available"
        },
        "transmit_bytes_per_second": {
          "value": 512,
          "status": "available"
        }
      }
    ],
    "load": {
      "one": {
        "value": 0.1,
        "status": "available"
      },
      "five": {
        "value": 0.2,
        "status": "available"
      },
      "fifteen": {
        "value": 0.3,
        "status": "available"
      }
    },
    "pressure": {
      "cpu": {
        "some": {
          "status": "unsupported",
          "avg10": null,
          "avg60": null,
          "avg300": null,
          "total_microseconds": null
        },
        "full": {
          "status": "unsupported",
          "avg10": null,
          "avg60": null,
          "avg300": null,
          "total_microseconds": null
        }
      },
      "memory": {
        "some": {
          "status": "unsupported",
          "avg10": null,
          "avg60": null,
          "avg300": null,
          "total_microseconds": null
        },
        "full": {
          "status": "unsupported",
          "avg10": null,
          "avg60": null,
          "avg300": null,
          "total_microseconds": null
        }
      },
      "io": {
        "some": {
          "status": "unsupported",
          "avg10": null,
          "avg60": null,
          "avg300": null,
          "total_microseconds": null
        },
        "full": {
          "status": "unsupported",
          "avg10": null,
          "avg60": null,
          "avg300": null,
          "total_microseconds": null
        }
      }
    }
  },
  "processes": {
    "top_cpu": {
      "items": [
        {
          "identity": {
            "boot_id": "11111111-1111-4111-8111-111111111111",
            "pid": 20,
            "start_ticks": 1000
          },
          "name": "worker",
          "state": "R",
          "parent": {
            "identity": {
              "boot_id": "11111111-1111-4111-8111-111111111111",
              "pid": 1,
              "start_ticks": 1
            },
            "status": "known"
          },
          "cpu_percent": 150,
          "rss_bytes": 8388608,
          "age_seconds": 990,
          "orphan_status": "uncertain",
          "former_parent": null
        },
        {
          "identity": {
            "boot_id": "11111111-1111-4111-8111-111111111111",
            "pid": 21,
            "start_ticks": 2000
          },
          "name": "zombie",
          "state": "Z",
          "parent": {
            "identity": null,
            "status": "unknown"
          },
          "cpu_percent": 0,
          "rss_bytes": 0,
          "age_seconds": 980,
          "orphan_status": "uncertain",
          "former_parent": null
        },
        {
          "identity": {
            "boot_id": "11111111-1111-4111-8111-111111111111",
            "pid": 22,
            "start_ticks": 3000
          },
          "name": "adopted",
          "state": "S",
          "parent": {
            "identity": {
              "boot_id": "11111111-1111-4111-8111-111111111111",
              "pid": 1,
              "start_ticks": 1
            },
            "status": "known"
          },
          "cpu_percent": 0,
          "rss_bytes": 8388608,
          "age_seconds": 970,
          "orphan_status": "proven",
          "former_parent": {
            "boot_id": "11111111-1111-4111-8111-111111111111",
            "pid": 10,
            "start_ticks": 500
          }
        }
      ],
      "completeness": "complete",
      "chunk_index": 0,
      "chunk_count": 1,
      "total_observed": 3,
      "reason": null
    },
    "top_rss": {
      "items": [
        {
          "identity": {
            "boot_id": "11111111-1111-4111-8111-111111111111",
            "pid": 20,
            "start_ticks": 1000
          },
          "name": "worker",
          "state": "R",
          "parent": {
            "identity": {
              "boot_id": "11111111-1111-4111-8111-111111111111",
              "pid": 1,
              "start_ticks": 1
            },
            "status": "known"
          },
          "cpu_percent": 150,
          "rss_bytes": 8388608,
          "age_seconds": 990,
          "orphan_status": "uncertain",
          "former_parent": null
        },
        {
          "identity": {
            "boot_id": "11111111-1111-4111-8111-111111111111",
            "pid": 22,
            "start_ticks": 3000
          },
          "name": "adopted",
          "state": "S",
          "parent": {
            "identity": {
              "boot_id": "11111111-1111-4111-8111-111111111111",
              "pid": 1,
              "start_ticks": 1
            },
            "status": "known"
          },
          "cpu_percent": 0,
          "rss_bytes": 8388608,
          "age_seconds": 970,
          "orphan_status": "proven",
          "former_parent": {
            "boot_id": "11111111-1111-4111-8111-111111111111",
            "pid": 10,
            "start_ticks": 500
          }
        },
        {
          "identity": {
            "boot_id": "11111111-1111-4111-8111-111111111111",
            "pid": 21,
            "start_ticks": 2000
          },
          "name": "zombie",
          "state": "Z",
          "parent": {
            "identity": null,
            "status": "unknown"
          },
          "cpu_percent": 0,
          "rss_bytes": 0,
          "age_seconds": 980,
          "orphan_status": "uncertain",
          "former_parent": null
        }
      ],
      "completeness": "complete",
      "chunk_index": 0,
      "chunk_count": 1,
      "total_observed": 3,
      "reason": null
    },
    "orphans": {
      "items": [
        {
          "identity": {
            "boot_id": "11111111-1111-4111-8111-111111111111",
            "pid": 22,
            "start_ticks": 3000
          },
          "name": "adopted",
          "state": "S",
          "parent": {
            "identity": {
              "boot_id": "11111111-1111-4111-8111-111111111111",
              "pid": 1,
              "start_ticks": 1
            },
            "status": "known"
          },
          "cpu_percent": 0,
          "rss_bytes": 8388608,
          "age_seconds": 970,
          "orphan_status": "proven",
          "former_parent": {
            "boot_id": "11111111-1111-4111-8111-111111111111",
            "pid": 10,
            "start_ticks": 500
          }
        }
      ],
      "completeness": "complete",
      "chunk_index": 0,
      "chunk_count": 1,
      "total_observed": 1,
      "reason": null
    },
    "zombies": {
      "items": [
        {
          "identity": {
            "boot_id": "11111111-1111-4111-8111-111111111111",
            "pid": 21,
            "start_ticks": 2000
          },
          "name": "zombie",
          "state": "Z",
          "parent": {
            "identity": null,
            "status": "unknown"
          },
          "cpu_percent": 0,
          "rss_bytes": 0,
          "age_seconds": 980,
          "orphan_status": "uncertain",
          "former_parent": null
        }
      ],
      "completeness": "complete",
      "chunk_index": 0,
      "chunk_count": 1,
      "total_observed": 1,
      "reason": null
    },
    "longest_running": {
      "items": [
        {
          "identity": {
            "boot_id": "11111111-1111-4111-8111-111111111111",
            "pid": 20,
            "start_ticks": 1000
          },
          "name": "worker",
          "state": "R",
          "parent": {
            "identity": {
              "boot_id": "11111111-1111-4111-8111-111111111111",
              "pid": 1,
              "start_ticks": 1
            },
            "status": "known"
          },
          "cpu_percent": 150,
          "rss_bytes": 8388608,
          "age_seconds": 990,
          "orphan_status": "uncertain",
          "former_parent": null
        },
        {
          "identity": {
            "boot_id": "11111111-1111-4111-8111-111111111111",
            "pid": 21,
            "start_ticks": 2000
          },
          "name": "zombie",
          "state": "Z",
          "parent": {
            "identity": null,
            "status": "unknown"
          },
          "cpu_percent": 0,
          "rss_bytes": 0,
          "age_seconds": 980,